{"$schema":"https://json-schema.org/draft/2020-12/schema","$id":"https://axignal.com/schemas/grants-application-workspace-runtime.schema.json","title":"AXIGNAL Grants Library and Application Workspace Runtime","type":"object","additionalProperties":false,"required":["schema_version","task_id","programme_version","status","canonical_activation_authorised","dependency_status","trust_principles","grants_library_binding","domain_modules","call_application_lifecycle","operating_pipeline","criterion_contract","consortium_contract","application_workspace_contract","application_pack_contract","budget_cofinancing_contract","readiness_contract","submission_award_contract","multilingual_contract","source_catalogue_contract","authority_model","rights_dimensions","observability","acceptance_gate"],"properties":{"schema_version":{"const":"axignal.grants-application-workspace-runtime/v0.1"},"task_id":{"const":"AX-GE2E-P09-T01"},"programme_version":{"const":"1.4.0"},"status":{"const":"DRAFT_ENGINEERING_FOUNDATION"},"canonical_activation_authorised":{"const":false},"dependency_status":{"type":"object","additionalProperties":false,"required":["normative_dependency_task","p07_engineering_head","p07_engineering_evidence_ready","p07_canonical_activation_authorised","engineering_base_task","p08_engineering_head","p08_engineering_evidence_ready","p08_canonical_activation_authorised","p06_canonical_activation_authorised","p05_canonical_activation_authorised","p04_canonical_activation_authorised","p03_canonical_activation_authorised","p02_canonical_activation_authorised","p01_dependency_satisfied","stacked_base_branch","merge_to_main_allowed"],"properties":{"normative_dependency_task":{"const":"AX-GE2E-P07-T01"},"p07_engineering_head":{"type":"string","pattern":"^[0-9a-f]{40}$"},"p07_engineering_evidence_ready":{"const":true},"p07_canonical_activation_authorised":{"const":false},"engineering_base_task":{"const":"AX-GE2E-P08-T01"},"p08_engineering_head":{"type":"string","pattern":"^[0-9a-f]{40}$"},"p08_engineering_evidence_ready":{"const":true},"p08_canonical_activation_authorised":{"const":false},"p06_canonical_activation_authorised":{"const":false},"p05_canonical_activation_authorised":{"const":false},"p04_canonical_activation_authorised":{"const":false},"p03_canonical_activation_authorised":{"const":false},"p02_canonical_activation_authorised":{"const":false},"p01_dependency_satisfied":{"const":false},"stacked_base_branch":{"const":"agent/ax-ge2e-p08-global-procurement-bid-workspace-v1.4"},"merge_to_main_allowed":{"const":false}}},"trust_principles":{"type":"array","minItems":16,"maxItems":16,"uniqueItems":true,"items":{"type":"string","minLength":12}},"grants_library_binding":{"type":"object","additionalProperties":false,"required":["library_id","workspace_type","canonical_name","entities","predicates","events","taxonomy_refs"],"properties":{"library_id":{"const":"AX-LIB-O02"},"workspace_type":{"const":"Application Workspace"},"canonical_name":{"const":"Grants and Non-Dilutive Funding"},"entities":{"type":"array","minItems":6,"maxItems":6,"uniqueItems":true,"items":{"type":"string"}},"predicates":{"type":"array","minItems":6,"maxItems":6,"uniqueItems":true,"items":{"type":"string"}},"events":{"type":"array","minItems":5,"maxItems":5,"uniqueItems":true,"items":{"type":"string"}},"taxonomy_refs":{"type":"array","minItems":3,"maxItems":3,"uniqueItems":true,"items":{"type":"string"}}}},"domain_modules":{"type":"array","minItems":8,"maxItems":8,"items":{"type":"object","additionalProperties":false,"required":["module_id","service_id","record_types","commands","queries","invariants"],"properties":{"module_id":{"enum":["CALL_REGISTRY","FUNDER_PROGRAMME","ELIGIBILITY_SCOPE","CONSORTIUM_PARTNERS","APPLICATION_WORKSPACE","NARRATIVE_EVIDENCE","BUDGET_CO_FINANCING","SUBMISSION_AWARD"]},"service_id":{"type":"string","pattern":"^[a-z][a-z0-9_]+$"},"record_types":{"type":"array","minItems":4,"maxItems":4,"uniqueItems":true,"items":{"type":"string"}},"commands":{"type":"array","minItems":4,"maxItems":4,"uniqueItems":true,"items":{"type":"string"}},"queries":{"type":"array","minItems":4,"maxItems":4,"uniqueItems":true,"items":{"type":"string"}},"invariants":{"type":"array","minItems":6,"maxItems":6,"uniqueItems":true,"items":{"type":"string","minLength":10}}}}},"call_application_lifecycle":{"type":"object","additionalProperties":false,"required":["states","allowed_transitions","terminal_states","rules"],"properties":{"states":{"type":"array","minItems":12,"maxItems":12,"uniqueItems":true,"items":{"type":"string"}},"allowed_transitions":{"type":"array","minItems":18,"uniqueItems":true,"items":{"type":"string","pattern":"^[A-Z_]+->[A-Z_]+$"}},"terminal_states":{"type":"array","minItems":2,"uniqueItems":true,"items":{"type":"string"}},"rules":{"type":"array","minItems":8,"maxItems":8,"uniqueItems":true,"items":{"type":"string"}}}},"operating_pipeline":{"type":"object","additionalProperties":false,"required":["stages","default_decision","indeterminate_as"],"properties":{"stages":{"type":"array","minItems":11,"maxItems":11,"items":{"type":"object","additionalProperties":false,"required":["stage_id","input","output","authority"],"properties":{"stage_id":{"type":"string","pattern":"^G(0[1-9]|1[01])_[A-Z_]+$"},"input":{"type":"string"},"output":{"type":"string"},"authority":{"enum":["DETERMINISTIC","CANDIDATE_ONLY","PROPOSAL_ONLY","HUMAN"]}}}},"default_decision":{"const":"DENY"},"indeterminate_as":{"const":"DENY"}}},"criterion_contract":{"type":"object","additionalProperties":false,"required":["classes","states"],"properties":{"classes":{"type":"array","minItems":10,"maxItems":10,"uniqueItems":true,"items":{"type":"string"}},"states":{"type":"array","minItems":7,"uniqueItems":true,"items":{"type":"string"}}}},"consortium_contract":{"type":"object","additionalProperties":false,"required":["roles","constraint_types","states"],"properties":{"roles":{"type":"array","minItems":6,"uniqueItems":true,"items":{"type":"string"}},"constraint_types":{"type":"array","minItems":8,"uniqueItems":true,"items":{"type":"string"}},"states":{"type":"array","minItems":6,"uniqueItems":true,"items":{"type":"string"}}}},"application_workspace_contract":{"type":"object","additionalProperties":false,"required":["states"],"properties":{"states":{"type":"array","minItems":9,"uniqueItems":true,"items":{"type":"string"}}}},"application_pack_contract":{"type":"object","additionalProperties":false,"required":["section_types"],"properties":{"section_types":{"type":"array","minItems":10,"uniqueItems":true,"items":{"type":"string"}}}},"budget_cofinancing_contract":{"type":"object","additionalProperties":false,"required":["value_types","cost_categories","states"],"properties":{"value_types":{"type":"array","minItems":9,"uniqueItems":true,"items":{"type":"string"}},"cost_categories":{"type":"array","minItems":7,"uniqueItems":true,"items":{"type":"string"}},"states":{"type":"array","minItems":6,"uniqueItems":true,"items":{"type":"string"}}}},"readiness_contract":{"type":"object","additionalProperties":false,"required":["gates","states"],"properties":{"gates":{"type":"array","minItems":12,"maxItems":12,"uniqueItems":true,"items":{"type":"string"}},"states":{"type":"array","minItems":6,"uniqueItems":true,"items":{"type":"string"}}}},"submission_award_contract":{"type":"object","additionalProperties":false,"required":["submission_states","award_states","required_approvals"],"properties":{"submission_states":{"type":"array","minItems":7,"uniqueItems":true,"items":{"type":"string"}},"award_states":{"type":"array","minItems":9,"uniqueItems":true,"items":{"type":"string"}},"required_approvals":{"type":"array","minItems":6,"uniqueItems":true,"items":{"type":"string"}}}},"multilingual_contract":{"type":"object","additionalProperties":false,"required":["languages","critical_dimensions"],"properties":{"languages":{"type":"array","minItems":6,"maxItems":6,"uniqueItems":true,"items":{"type":"string"}},"critical_dimensions":{"type":"array","minItems":10,"uniqueItems":true,"items":{"type":"string"}}}},"source_catalogue_contract":{"type":"object","additionalProperties":false,"required":["catalogue_id","status","source_count","all_sources_product_admitted","all_rights_reviewed","public_coverage_authorised"],"properties":{"catalogue_id":{"const":"AX-GRANTS-SOURCE-CATALOGUE-001"},"status":{"const":"RESEARCH_CATALOGUE_NOT_PRODUCT_AVAILABILITY"},"source_count":{"const":6},"all_sources_product_admitted":{"const":false},"all_rights_reviewed":{"const":false},"public_coverage_authorised":{"const":false}}},"authority_model":{"type":"object","additionalProperties":false,"required":["actors","forbidden_actions","least_authority_rule"],"properties":{"actors":{"type":"object","minProperties":11,"additionalProperties":{"type":"string"}},"forbidden_actions":{"type":"array","minItems":10,"uniqueItems":true,"items":{"type":"string"}},"least_authority_rule":{"const":true}}},"rights_dimensions":{"type":"array","minItems":10,"maxItems":10,"uniqueItems":true,"items":{"type":"string"}},"observability":{"type":"object","additionalProperties":false,"required":["metrics","alerts"],"properties":{"metrics":{"type":"array","minItems":16,"uniqueItems":true,"items":{"type":"string"}},"alerts":{"type":"array","minItems":16,"uniqueItems":true,"items":{"type":"string"}}}},"acceptance_gate":{"type":"object","additionalProperties":false,"required":["required_before_canonical_activation","current_decision"],"properties":{"required_before_canonical_activation":{"type":"array","minItems":22,"maxItems":22,"uniqueItems":true,"items":{"type":"string"}},"current_decision":{"const":"NOT_READY_FOR_CANONICAL_ACTIVATION"}}}}}