{"schema_version":"axignal.grants-application-workspace-runtime/v0.1","task_id":"AX-GE2E-P09-T01","programme_version":"1.4.0","status":"DRAFT_ENGINEERING_FOUNDATION","canonical_activation_authorised":false,"dependency_status":{"normative_dependency_task":"AX-GE2E-P07-T01","p07_engineering_head":"e30f800cb284f1381c28c4ccbc116a8da4a9fe92","p07_engineering_evidence_ready":true,"p07_canonical_activation_authorised":false,"engineering_base_task":"AX-GE2E-P08-T01","p08_engineering_head":"3e28e08a12d02701d4ab312edfbedc56fcd8bb59","p08_engineering_evidence_ready":true,"p08_canonical_activation_authorised":false,"p06_canonical_activation_authorised":false,"p05_canonical_activation_authorised":false,"p04_canonical_activation_authorised":false,"p03_canonical_activation_authorised":false,"p02_canonical_activation_authorised":false,"p01_dependency_satisfied":false,"stacked_base_branch":"agent/ax-ge2e-p08-global-procurement-bid-workspace-v1.4","merge_to_main_allowed":false},"trust_principles":["Calls, programmes, applicants, submissions and awards remain distinct.","Every object keeps source, rights, language, jurisdiction and time lineage.","An open call does not prove eligibility, budget availability or suitability.","Amendments supersede affected fields without deleting prior versions.","Funder, authority, payer and intermediary identities remain distinct.","Applicant, coordinator, beneficiary and subcontractor roles remain distinct.","Eligibility, exclusions and evidence are evaluated independently.","Non-dilutive funding can still impose duties, repayment or clawback.","Application readiness requires every current deterministic gate.","Models and workers cannot attest, sign, submit or create awards.","Deadlines retain timezone, calendar, cut-off and uncertainty.","Cost, eligible cost, grant request, co-financing and payment stay distinct.","Receipts, awards, agreements and payments require observed evidence.","Reachability never proves global coverage or legal compliance.","Imported content remains candidate-only with no live approvals.","Consequential actions require typed humans and deterministic preflight."],"grants_library_binding":{"library_id":"AX-LIB-O02","workspace_type":"Application Workspace","canonical_name":"Grants and Non-Dilutive Funding","entities":["FundingOpportunity","FundingCall","Programme","Funder","Applicant","Grant"],"predicates":["FUNDED_BY","ELIGIBLE_FOR","HAS_BUDGET","HAS_DEADLINE","TARGETS","REQUIRES"],"events":["CALL_OPENED","CALL_AMENDED","DEADLINE_CHANGED","AWARD_ANNOUNCED","CALL_CLOSED"],"taxonomy_refs":["NACE","NAICS","TRL"]},"domain_modules":[{"module_id":"CALL_REGISTRY","service_id":"funding_call_registry","record_types":["FundingCall","CallVersion","CallAmendment","FundingTopic"],"commands":["register_call","register_call_amendment","withdraw_call","supersede_call"],"queries":["get_call","get_current_call_version","list_call_amendments","trace_call_lineage"],"invariants":["Call versions are immutable.","Call events remain distinct.","Source-native identifiers persist.","Currentness reconciles amendments.","Withdrawn calls add zero readiness.","Duplicates link without silent merge."]},{"module_id":"FUNDER_PROGRAMME","service_id":"funder_programme_service","record_types":["Funder","Programme","FundingInstrument","ManagingAuthority"],"commands":["resolve_funder","register_programme","register_instrument","contest_funder_match"],"queries":["get_funder","get_programme","get_instrument","explain_funder_resolution"],"invariants":["Funder and payer stay distinct.","Probabilistic matches stay candidates.","Instrument type proves no eligibility.","Jurisdiction rules are explicit.","Programme and call budgets differ.","Cross-tenant links grant no authority."]},{"module_id":"ELIGIBILITY_SCOPE","service_id":"grant_eligibility_service","record_types":["EligibilityCriterion","ExclusionCriterion","TargetScope","EvidenceRequirement"],"commands":["register_criterion","assess_eligibility","record_exclusion","map_evidence_requirement"],"queries":["get_criterion","evaluate_eligibility","list_evidence_gaps","explain_scope_lineage"],"invariants":["Observed and inferred criteria differ.","Eligibility is applicant and call scoped.","Unknown mandatory criteria never pass.","Active exclusions deny qualification.","Sector, geography and TRL stay separate.","Extraction confidence proves no eligibility."]},{"module_id":"CONSORTIUM_PARTNERS","service_id":"grant_consortium_service","record_types":["Applicant","Consortium","PartnerRole","ParticipationConstraint"],"commands":["register_applicant","form_consortium","assign_partner_role","record_participation_constraint"],"queries":["get_applicant","get_consortium","evaluate_consortium","list_partner_gaps"],"invariants":["Applicant identity is version pinned.","Membership grants no submission right.","Partner roles remain distinct.","Participation constraints are explicit.","Partner changes invalidate readiness.","Partner private data stays tenant scoped."]},{"module_id":"APPLICATION_WORKSPACE","service_id":"application_workspace_service","record_types":["ApplicationWorkspace","ApplicationStrategy","ApplicationTeam","WorkPackage"],"commands":["open_application_workspace","select_topic","assign_application_role","close_application_workspace"],"queries":["get_application_workspace","compute_application_readiness","list_application_work","explain_workspace_state"],"invariants":["Workspace binds one call version.","Opening requires P07 pursue approval.","Team roles grant no signature right.","Tenant is resolved server-side.","Strategy and consortium are versioned.","Closed workspaces cannot submit."]},{"module_id":"NARRATIVE_EVIDENCE","service_id":"application_content_service","record_types":["ApplicationSection","EvidenceAttachment","ImpactPathway","EthicsRequirement"],"commands":["draft_application_section","attach_application_evidence","record_impact_pathway","assess_ethics_requirement"],"queries":["get_application_pack","list_narrative_gaps","validate_evidence_currentness","trace_application_anchors"],"invariants":["Assertions link criteria and anchors.","Draft prose never replaces evidence.","Stale evidence adds zero readiness.","Impact claims retain uncertainty.","Ethics declarations require humans.","Translations retain source text."]},{"module_id":"BUDGET_CO_FINANCING","service_id":"grant_budget_service","record_types":["ApplicationBudget","CostCategory","CoFinancingPlan","FundingRate"],"commands":["record_application_budget","record_cost_category","record_cofinancing","validate_funding_rate"],"queries":["get_application_budget","calculate_requested_grant","list_budget_assumptions","explain_funding_lineage"],"invariants":["Cost values remain distinct.","Unknown eligibility blocks validation.","FX requires rate source and time.","Cost categories retain programme rules.","Model budgets are proposals only.","Workers cannot confirm co-financing."]},{"module_id":"SUBMISSION_AWARD","service_id":"grant_submission_award_service","record_types":["ApplicationPackage","ApplicationReceipt","GrantAward","GrantAgreement"],"commands":["prepare_application_package","record_external_application","register_grant_award","record_grant_agreement"],"queries":["validate_application_preflight","get_application_receipt","get_grant_award","trace_award_evidence"],"invariants":["Preparation and submission differ.","Submission authority is human-only.","Submission requires current gates.","Receipts require observed evidence.","Award, agreement and payment differ.","Submission never implies an award."]}],"call_application_lifecycle":{"states":["DISCOVERED","OPEN","AMENDED","QUALIFYING","CONSORTIUM_FORMING","APPLICATION_PREPARATION","REVIEW_READY","SUBMISSION_READY","SUBMITTED_EXTERNALLY","AWARD_ANNOUNCED","AGREEMENT_SIGNED","CLOSED_OR_WITHDRAWN"],"allowed_transitions":["DISCOVERED->OPEN","OPEN->AMENDED","OPEN->QUALIFYING","OPEN->CLOSED_OR_WITHDRAWN","AMENDED->QUALIFYING","AMENDED->CLOSED_OR_WITHDRAWN","QUALIFYING->CONSORTIUM_FORMING","QUALIFYING->APPLICATION_PREPARATION","QUALIFYING->CLOSED_OR_WITHDRAWN","CONSORTIUM_FORMING->APPLICATION_PREPARATION","CONSORTIUM_FORMING->CLOSED_OR_WITHDRAWN","APPLICATION_PREPARATION->REVIEW_READY","APPLICATION_PREPARATION->CLOSED_OR_WITHDRAWN","REVIEW_READY->APPLICATION_PREPARATION","REVIEW_READY->SUBMISSION_READY","SUBMISSION_READY->APPLICATION_PREPARATION","SUBMISSION_READY->SUBMITTED_EXTERNALLY","SUBMITTED_EXTERNALLY->AWARD_ANNOUNCED","SUBMITTED_EXTERNALLY->CLOSED_OR_WITHDRAWN","AWARD_ANNOUNCED->AGREEMENT_SIGNED","AWARD_ANNOUNCED->CLOSED_OR_WITHDRAWN","AGREEMENT_SIGNED->CLOSED_OR_WITHDRAWN"],"terminal_states":["AGREEMENT_SIGNED","CLOSED_OR_WITHDRAWN"],"rules":["Lifecycle rule 1 is fail-closed.","Lifecycle rule 2 is fail-closed.","Lifecycle rule 3 is fail-closed.","Lifecycle rule 4 is fail-closed.","Lifecycle rule 5 is fail-closed.","Lifecycle rule 6 is fail-closed.","Lifecycle rule 7 is fail-closed.","Lifecycle rule 8 is fail-closed."]},"operating_pipeline":{"stages":[{"stage_id":"G01_DISCOVER","input":"CandidateFundingSignal","output":"FundingOpportunityCandidate","authority":"CANDIDATE_ONLY"},{"stage_id":"G02_NORMALIZE","input":"FundingOpportunityCandidate","output":"VersionedFundingCall","authority":"CANDIDATE_ONLY"},{"stage_id":"G03_RESOLVE_FUNDER","input":"VersionedFundingCall","output":"FunderProgrammeCandidates","authority":"PROPOSAL_ONLY"},{"stage_id":"G04_EXTRACT_SCOPE","input":"VersionedFundingCall","output":"ScopeAndCriterionCandidates","authority":"CANDIDATE_ONLY"},{"stage_id":"G05_ASSESS_ELIGIBILITY","input":"ScopeAndCriterionCandidates","output":"EligibilityAssessment","authority":"PROPOSAL_ONLY"},{"stage_id":"G06_FORM_CONSORTIUM","input":"ApprovedEligibility","output":"ConsortiumCandidate","authority":"HUMAN"},{"stage_id":"G07_OPEN_APPLICATION_WORKSPACE","input":"ApprovedPursueDecision","output":"ApplicationWorkspace","authority":"HUMAN"},{"stage_id":"G08_PREPARE_APPLICATION","input":"ApplicationWorkspace","output":"ApplicationPackCandidates","